{
  "$schema": "../schema/ghid-teren.schema.json",
  "id": "unnpr-terenuri-caras-severin-2026",
  "title": "Studiu de piață — terenuri, județul Caraș-Severin, 2026",
  "publisher": "Uniunea Națională a Notarilor Publici din România — CNP Timișoara",
  "counties": [
    "CS"
  ],
  "period": "2026",
  "currency": "EUR",
  "unit": "EUR/m²",
  "provenance": {
    "source": "unnpr-terenuri-caras-severin-2026",
    "locator": "https://www.unnpr.ro/files/expertize2026/CNPTimisoara/Anexe_Caras_Severin_2026.pdf, anexele cu valorile orientative minime",
    "confidence": "verbatim",
    "note": "Valorile sunt copiate din tabelele studiului, nu recalculate. Intravilanul este publicat pe sat, extravilanul pe comună; separarea este păstrată."
  },
  "summary": {
    "pages": 43,
    "zonedLocalities": 8,
    "communes": 68,
    "villages": 136,
    "communesWithExtravilan": 68,
    "rosterMunicipii": 2,
    "rosterOrase": 6,
    "rosterComune": 69,
    "rosterMissingFromTable": [
      "TARNOVA"
    ],
    "tableMissingFromRoster": [],
    "townsWithoutZoneGrid": [],
    "duplicateLocalities": [],
    "forestPriceScope": null,
    "numberingProblems": [],
    "coverage": {
      "localitiesExpected": 77,
      "localitiesPriced": 76,
      "share": 0.987
    }
  },
  "categories": [
    {
      "code": "CC",
      "label": "curti constructii"
    },
    {
      "code": "V+L",
      "label": "vii si livezi"
    },
    {
      "code": "P+F",
      "label": "pasuni si fanete"
    },
    {
      "code": "TAPA SI NP",
      "label": "terenuri sub ape si neproductive"
    },
    {
      "code": "TS",
      "label": "terenuri cu destinatie speciala"
    },
    {
      "code": "A",
      "label": "arabil"
    }
  ],
  "extravilanCategories": [
    "A",
    "V+L",
    "P+F",
    "CC",
    "AP",
    "DR",
    "NP"
  ],
  "roster": {
    "municipii": [
      "RESITA",
      "CARANSEBES"
    ],
    "orase": [
      "ANINA",
      "BAILE HERCULANE",
      "BOCSA",
      "MOLDOVA NOUA",
      "ORAVITA",
      "OTELU ROSU"
    ],
    "comune": [
      "OCNA DE FIER",
      "ARMENIS",
      "BANIA",
      "BAUTAR",
      "BERLISTE",
      "BERZASCA",
      "BERZOVIA",
      "BOLVASNITA",
      "BOZOVICI",
      "BREBU",
      "BREBU NOU",
      "BUCHIN",
      "BUCOSNITA",
      "CARASOVA",
      "CARBUNARI",
      "CONSTANTIN DAICOVICIU",
      "CICLOVA ROMANA",
      "CIUCHICI",
      "CIUDANOVITA",
      "COPACELE",
      "CORNEA",
      "CORNEREVA",
      "DALBOSET",
      "DOCLIN",
      "DOGNECEA",
      "DOMASNEA",
      "EZERIS",
      "FARLIUG",
      "FOROTIC",
      "GARNIC",
      "GLIMBOCA",
      "GORUIA",
      "GRADINARI",
      "IABLANITA",
      "LAPUSNICEL",
      "LAPUSNICU MARE",
      "LUNCAVITA",
      "LUPAC",
      "MARGA",
      "MAURENI",
      "MEHADIA",
      "MEHADICA",
      "NAIDAS",
      "OBREJA",
      "PALTINIS",
      "CORONINI",
      "POJEJENA",
      "PRIGOR",
      "RAMNA",
      "RACASDIA",
      "EFTIMIE MURGU",
      "RUSCA MONTANA",
      "SACU",
      "SASCA MONTANA",
      "SICHEVITA",
      "SLATINA-TIMIS",
      "SOCOL",
      "SOPOTU NOU",
      "TEREGOVA",
      "TICVANIU MARE",
      "TARNOVA",
      "TOPLET",
      "TURNU RUIENI",
      "VALIUG",
      "VARADIA",
      "VERMES",
      "VRANI",
      "ZAVOI",
      "ZORLENTU MARE"
    ]
  },
  "zoned": [
    {
      "name": "RESITA",
      "rank": "municipii",
      "zones": [
        "A",
        "B",
        "C",
        "D"
      ],
      "intravilan": {
        "CC": {
          "A": 80.0,
          "B": 50.0,
          "C": 30.0,
          "D": 13.0
        }
      },
      "extravilan": {
        "A": 0.6,
        "P+F": 0.36,
        "V+L": 0.36,
        "PADURE": 0.54,
        "AP": 0.9,
        "NP": 0.42
      },
      "page": 1
    },
    {
      "name": "CARANSEBES",
      "rank": "municipii",
      "zones": [
        "A",
        "B",
        "C",
        "D"
      ],
      "intravilan": {
        "CC": {
          "A": 80.0,
          "B": 50.0,
          "C": 30.0,
          "D": 10.0
        }
      },
      "extravilan": {
        "A": 0.7,
        "P+F": 0.42,
        "V+L": 0.42,
        "PADURE": 0.63,
        "AP": 1.05,
        "NP": 0.49
      },
      "page": 1
    },
    {
      "name": "ANINA",
      "rank": "orase",
      "zones": [
        "A",
        "B",
        "C"
      ],
      "intravilan": {
        "CC": {
          "A": 10.0,
          "B": 8.0,
          "C": 4.0
        }
      },
      "extravilan": {
        "A": 0.4,
        "P+F": 0.24,
        "V+L": 0.24,
        "PADURE": 0.36,
        "AP": 0.6,
        "NP": 0.28
      },
      "page": 1
    },
    {
      "name": "BAILE HERCULANE",
      "rank": "orase",
      "zones": [
        "A",
        "B",
        "C"
      ],
      "intravilan": {
        "CC": {
          "A": 100.0,
          "B": 55.0,
          "C": 25.0
        }
      },
      "extravilan": {
        "A": 0.6,
        "P+F": 0.36,
        "V+L": 0.36,
        "PADURE": 0.54,
        "AP": 0.9,
        "NP": 0.42
      },
      "page": 1
    },
    {
      "name": "BOCSA",
      "rank": "orase",
      "zones": [
        "A",
        "B",
        "C"
      ],
      "intravilan": {
        "CC": {
          "A": 23.0,
          "B": 17.0,
          "C": 7.0
        }
      },
      "extravilan": {
        "A": 0.5,
        "P+F": 0.3,
        "V+L": 0.3,
        "PADURE": 0.45,
        "AP": 0.75,
        "NP": 0.35
      },
      "page": 1
    },
    {
      "name": "MOLDOVA NOUA",
      "rank": "orase",
      "zones": [
        "A",
        "B",
        "C"
      ],
      "intravilan": {
        "CC": {
          "A": 27.0,
          "B": 17.0,
          "C": 7.0
        }
      },
      "extravilan": {
        "A": 0.5,
        "P+F": 0.3,
        "V+L": 0.3,
        "PADURE": 0.45,
        "AP": 0.75,
        "NP": 0.35
      },
      "page": 1
    },
    {
      "name": "ORAVITA",
      "rank": "orase",
      "zones": [
        "A",
        "B",
        "C"
      ],
      "intravilan": {
        "CC": {
          "A": 23.0,
          "B": 13.0,
          "C": 7.0
        }
      },
      "extravilan": {
        "A": 0.45,
        "P+F": 0.27,
        "V+L": 0.27,
        "PADURE": 0.405,
        "AP": 0.675,
        "NP": 0.315
      },
      "page": 1
    },
    {
      "name": "OTELU ROSU",
      "rank": "orase",
      "zones": [
        "A",
        "B",
        "C"
      ],
      "intravilan": {
        "CC": {
          "A": 33.0,
          "B": 17.0,
          "C": 9.0
        }
      },
      "extravilan": {
        "A": 0.6,
        "P+F": 0.36,
        "V+L": 0.36,
        "PADURE": 0.54,
        "AP": 0.9,
        "NP": 0.42
      },
      "page": 1
    }
  ],
  "communes": [
    {
      "name": "ARMENIS",
      "villages": [
        {
          "name": "Armenis",
          "intravilan": {
            "CC": 7.0
          }
        },
        {
          "name": "Armenis (sate)",
          "intravilan": {
            "CC": 5.0
          }
        }
      ],
      "extravilan": {
        "A": 0.45,
        "P+F": 0.27,
        "V+L": 0.27,
        "PADURE": 0.405,
        "AP": 0.675,
        "NP": 0.315
      },
      "page": 1,
      "index": 1,
      "matchedRoster": true,
      "rank": "comune"
    },
    {
      "name": "BANIA",
      "villages": [
        {
          "name": "Bania",
          "intravilan": {
            "CC": 5.0
          }
        },
        {
          "name": "Bania (sate)",
          "intravilan": {
            "CC": 4.0
          }
        }
      ],
      "extravilan": {
        "A": 0.4,
        "P+F": 0.24,
        "V+L": 0.24,
        "PADURE": 0.36,
        "AP": 0.6,
        "NP": 0.28
      },
      "page": 1,
      "index": 2,
      "matchedRoster": true,
      "rank": "comune"
    },
    {
      "name": "BAUTAR",
      "villages": [
        {
          "name": "Bautar",
          "intravilan": {
            "CC": 7.0
          }
        },
        {
          "name": "Bautar (sate)",
          "intravilan": {
            "CC": 5.0
          }
        }
      ],
      "extravilan": {
        "A": 0.45,
        "P+F": 0.27,
        "V+L": 0.27,
        "PADURE": 0.405,
        "AP": 0.675,
        "NP": 0.315
      },
      "page": 1,
      "index": 3,
      "matchedRoster": true,
      "rank": "comune"
    },
    {
      "name": "BERLISTE",
      "villages": [
        {
          "name": "Berliste",
          "intravilan": {
            "CC": 4.0
          }
        },
        {
          "name": "Berliste (sate)",
          "intravilan": {
            "CC": 2.0
          }
        }
      ],
      "extravilan": {
        "A": 0.35,
        "P+F": 0.21,
        "V+L": 0.21,
        "PADURE": 0.315,
        "AP": 0.525,
        "NP": 0.245
      },
      "page": 1,
      "index": 4,
      "matchedRoster": true,
      "rank": "comune"
    },
    {
      "name": "BERZASCA",
      "villages": [
        {
          "name": "Berzasca",
          "intravilan": {
            "CC": 7.0
          }
        },
        {
          "name": "Berzasca (sate)",
          "intravilan": {
            "CC": 5.0
          }
        }
      ],
      "extravilan": {
        "A": 0.45,
        "P+F": 0.27,
        "V+L": 0.27,
        "PADURE": 0.405,
        "AP": 0.675,
        "NP": 0.315
      },
      "page": 1,
      "index": 5,
      "matchedRoster": true,
      "rank": "comune"
    },
    {
      "name": "BERZOVIA",
      "villages": [
        {
          "name": "Berzovia",
          "intravilan": {
            "CC": 7.0
          }
        },
        {
          "name": "Berzovia (sate)",
          "intravilan": {
            "CC": 5.0
          }
        }
      ],
      "extravilan": {
        "A": 0.45,
        "P+F": 0.27,
        "V+L": 0.27,
        "PADURE": 0.405,
        "AP": 0.675,
        "NP": 0.315
      },
      "page": 1,
      "index": 6,
      "matchedRoster": true,
      "rank": "comune"
    },
    {